cluster_id,segment_name,segment_group,user_count,pct_of_total_users,avg_recency_days,avg_total_sessions,avg_purchase_rate,avg_order_value,avg_total_value,avg_session_duration_sec,avg_carts,recommended_action
0,"Frequent Browsers, Low Spend",buyer,189832,3.5705788008451327,7.913897551519238,24.230635509292426,0.17560154941205136,128.86966284216615,2865.3233894750624,389.90640393547756,9.487778667453327,Promote bundle deals or limited-time offers to convert browsing into purchases.
1,High-Value Lapsed,buyer,121662,2.2883589598614593,43.224014071772615,2.786687708569644,0.6709507897199776,481.62619491398516,1116.9293373684243,731.6576817513105,1.2198056911771957,Trigger win-back email/push campaign — discount code or 'we miss you' offer given high historical spend.
2,Occasional Low-Value,buyer,219992,4.137862802665106,13.747186261318593,10.374531801156406,0.1766788217860835,58.153477186090676,542.7391197257663,255.0711610918821,1.3521628059202153,Low priority for active marketing spend; consider lightweight retargeting only.
3,High-Value Active,buyer,159317,2.996617550329997,11.966732991457283,3.784423507849131,0.6354966488042677,521.675453381971,1997.1209625287297,348.50111737634523,3.101709171023808,"Protect and reward — loyalty perks, early access, premium membership upsell."
100,Drive-by Visitors,non_buyer,2523061,47.456635972012734,28.10188100882222,1.4645060107543972,,,,36.25963298358745,0.02249212365456087,Low priority; minimal signal to act on from a single short visit.
101,Engaged Browsers (No Cart),non_buyer,1727653,32.49568659138868,18.92205089795231,4.643815048508005,,,,1944.93950951049,0.03990326761218833,"Retarget with product education content, reviews, or comparison guides to build buying confidence."
102,Cart Abandoners,non_buyer,375044,7.054259322896887,11.403861946864902,12.154456543765532,,,,410.3631614259918,2.9026940838941564,Highest-priority retargeting — cart-abandonment email/discount within 24-48 hours.
